### ISSUE TITLE
Onboarding OpenVINO application - no packets arrive at the openvino-cons-app side

### ISSUE THREAD

**Issue by adtrytech** [open-ness/specs#62]
Hi Teams,

I am a newer of the OpenNESS. I already created a cluster by "CERA Media Analytics Flavor" and accomplished 1th Onboarding sample application successfully. But, I got fail on Onboarding OpenVINO application. There are no inference results pop up at the client simulator.

It seems that there are no packets arriving at the openvino-cons-app(hosted by the edge node) side. (I used the tcpdump to monitoring the eth0 in the openvino-cons-app pod). But, the edge node got packets from the client simulator.

Could anyone help me to resolve this issue? Thank you! 

The client host hangs on the following situation:
[root@localhost clientsim]# ./run-docker.sh 
ffplay version 2.8.17-0ubuntu0.1 Copyright (c) 2003-2020 the FFmpeg developers
  built with gcc 5.4.0 (Ubuntu 5.4.0-6ubuntu1~16.04.12) 20160609
  configuration: --prefix=/usr --extra-version=0ubuntu0.1 --build-suffix=-ffmpeg --toolchain=hardened --libdir=/usr/lib/x86_64-linux-gnu --incdir=/usr/include/x86_64-linux-gnu --cc=cc --cxx=g++ --enable-gpl --enable-shared --disable-stripping --disable-decoder=libopenjpeg --disable-decoder=libschroedinger --enable-avresample --enable-avisynth --enable-gnutls --enable-ladspa --enable-libass --enable-libbluray --enable-libbs2b --enable-libcaca --enable-libcdio --enable-libflite --enable-libfontconfig --enable-libfreetype --enable-libfribidi --enable-libgme --enable-libgsm --enable-libmodplug --enable-libmp3lame --enable-libopenjpeg --enable-libopus --enable-libpulse --enable-librtmp --enable-libschroedinger --enable-libshine --enable-libsnappy --enable-libsoxr --enable-libspeex --enable-libssh --enable-libtheora --enable-libtwolame --enable-libvorbis --enable-libvpx --enable-libwavpack --enable-libwebp --enable-libx265 --enable-libxvid --enable-libzvbi --enable-openal --enable-opengl --enable-x11grab --enable-libdc1394 --enable-libiec61883 --enable-libzmq --enable-frei0r --enable-libx264 --enable-libopencv
  libavutil      54. 31.100 / 54. 31.100
  libavcodec     56. 60.100 / 56. 60.100
  libavformat    56. 40.101 / 56. 40.101
  libavdevice    56.  4.100 / 56.  4.100
  libavfilter     5. 40.101 /  5. 40.101
  libavresample   2.  1.  0 /  2.  1.  0
  libswscale      3.  1.101 /  3.  1.101
  libswresample   1.  2.101 /  1.  2.101
  libpostproc    53.  3.100 / 53.  3.100
ALSA lib confmisc.c:768:(parse_card) cannot find card '0'
ALSA lib conf.c:4292:(_snd_config_evaluate) function snd_func_card_driver returned error: No such file or directory
ALSA lib confmisc.c:392:(snd_func_concat) error evaluating strings
ALSA lib conf.c:4292:(_snd_config_evaluate) function snd_func_concat returned error: No such file or directory
ALSA lib confmisc.c:1251:(snd_func_refer) error evaluating name
ALSA lib conf.c:4292:(_snd_config_evaluate) function snd_func_refer returned error: No such file or directory
ALSA lib conf.c:4771:(snd_config_expand) Evaluate error: No such file or directory
ALSA lib pcm.c:2266:(snd_pcm_open_noupdate) Unknown PCM default
[sdp @ 0x7fc88c000920] Could not find codec parameters for stream 0 (Video: mjpeg, none(bt470bg/unknown/unknown)): unspecified size
Consider increasing the value for the 'analyzeduration' and 'probesize' options
downstream.sdp: could not find codec parameters
    nan    :  0.000 fd=   0 aq=    0KB vq=    0KB sq=    0B f=0/0   
./tx_video.sh

**Comment by adtrytech** [comment]
Hi All,

Update the status.
After modify the network policies, the openvino-cons-app pod receive lots of packets as below:
...
09:16:59.863274 IP analytics.openness.56891 > openvino-cons-app-6744f45755-xn59l.5000: UDP, length 1200
09:16:59.863301 IP analytics.openness.56891 > openvino-cons-app-6744f45755-xn59l.5000: UDP, length 1200
09:16:59.863329 IP analytics.openness.56891 > openvino-cons-app-6744f45755-xn59l.5000: UDP, length 1200
...

But, there is still no inference result at the client simulator side. 
Could anyone can help me on this?

Thank you!

**Comment by adtrytech** [comment]
Hi All,

Update the status.

After running the ffplayer separately, the inference result is pop up. But, the video quality is very poor and transparent. There was an interesting message as below.

ffplay version 2.8.17-0ubuntu0.1 Copyright (c) 2003-2020 the FFmpeg developers
  built with gcc 5.4.0 (Ubuntu 5.4.0-6ubuntu1~16.04.12) 20160609
  configuration: --prefix=/usr --extra-version=0ubuntu0.1 --build-suffix=-ffmpeg --toolchain=hardened --libdir=/usr/lib/x86_64-linux-gnu
  --incdir=/usr/include/x86_64-linux-gnu --cc=cc --cxx=g++ --enable-gpl --enable-shared --disable-stripping --disable-decoder=libopenjpeg
  --disable-decoder=libschroedinger --enable-avresample --enable-avisynth --enable-gnutls --enable-ladspa --enable-libass --enable-libbluray
  --enable-libbs2b --enable-libcaca --enable-libcdio --enable-libflite --enable-libfontconfig --enable-libfreetype --enable-libfribidi
  --enable-libgme --enable-libgsm --enable-libmodplug --enable-libmp3lame --enable-libopenjpeg --enable-libopus --enable-libpulse
  --enable-librtmp --enable-libschroedinger --enable-libshine --enable-libsnappy --enable-libsoxr --enable-libspeex --enable-libssh
  --enable-libtheora --enable-libtwolame --enable-libvorbis --enable-libvpx --enable-libwavpack --enable-libwebp --enable-libx265
  --enable-libxvid --enable-libzvbi --enable-openal --enable-opengl --enable-x11grab --enable-libdc1394 --enable-libiec61883 --enable-libzmq
  --enable-frei0r --enable-libx264 --enable-libopencv
  libavutil      54. 31.100 / 54. 31.100
  libavcodec     56. 60.100 / 56. 60.100
  libavformat    56. 40.101 / 56. 40.101
  libavdevice    56.  4.100 / 56.  4.100
  libavfilter     5. 40.101 /  5. 40.101
  libavresample   2.  1.  0 /  2.  1.  0
  libswscale      3.  1.101 /  3.  1.101
  libswresample   1.  2.101 /  1.  2.101
  libpostproc    53.  3.100 / 53.  3.100
ALSA lib confmisc.c:768:(parse_card) cannot find card '0'
ALSA lib conf.c:4292:(_snd_config_evaluate) function snd_func_card_driver returned error: No such file or directory
ALSA lib confmisc.c:392:(snd_func_concat) error evaluating strings
ALSA lib conf.c:4292:(_snd_config_evaluate) function snd_func_concat returned error: No such file or directory
ALSA lib confmisc.c:1251:(snd_func_refer) error evaluating name
ALSA lib conf.c:4292:(_snd_config_evaluate) function snd_func_refer returned error: No such file or directory
ALSA lib conf.c:4771:(snd_config_expand) Evaluate error: No such file or directory
ALSA lib pcm.c:2266:(snd_pcm_open_noupdate) Unknown PCM default
[mjpeg @ 0x7f32940076a0] Changeing bps to 8   0KB sq=    0B f=0/0
Input #0, sdp, from 'downstream.sdp':B vq=    0KB sq=    0B f=0/0
  Metadata:
    title           : No Name
  Duration: N/A, start: 0.000000, bitrate: N/A
    Stream #0:0: Video: mjpeg, yuvj420p(pc, bt470bg/unknown/unknown), 1920x1080 [SAR 1:1 DAR 16:9], 30 fps, 30 tbr, 90k tbn, 90k tbc
**[swscaler @ 0x7f328c33d0a0] deprecated pixel format used, make sure you did set range correctly**
[sdp @ 0x7f3294000920] Missing packets; dropping frame.  0B f=0/0
    Last message repeated 92 times

Could anyone give some advice to resolve the bad quality issue?  Thank you!.
